<?xml version="1.0" encoding="UTF-8"?>
<Configuration xmlns:xsi="http://www.w3.org/2001/XMLSchema-instance" xsi:noNamespaceSchemaLocation="schema/object.xsd">
    <name>AUSPatient</name>
    <database>Oracle</database>
    <dateformat>MM/dd/yyyy</dateformat>
    <nodes>
        <tag>AUSPatient</tag>
        <fields>
            <field-name>FirstName</field-name>
            <field-type>string</field-type>
            <size>40</size>
            <updateable>true</updateable>
            <required>true</required>
            <code-module></code-module>
            <pattern></pattern>
            <key-type>false</key-type>
        </fields>
        <fields>
            <field-name>FirstName_Std</field-name>
            <field-type>string</field-type>
            <size>40</size>
            <updateable>true</updateable>
            <required>false</required>
            <code-module></code-module>
            <pattern></pattern>
            <key-type>false</key-type>
        </fields>
        <fields>
            <field-name>FirstName_Phon</field-name>
            <field-type>string</field-type>
            <size>8</size>
            <updateable>true</updateable>
            <required>false</required>
            <code-module></code-module>
            <pattern></pattern>
            <key-type>false</key-type>
        </fields>
        <fields>
            <field-name>MiddleName</field-name>
            <field-type>string</field-type>
            <size>30</size>
            <updateable>true</updateable>
            <required>false</required>
            <code-module></code-module>
            <pattern></pattern>
            <key-type>false</key-type>
        </fields>
        <fields>
            <field-name>MiddleName_Std</field-name>
            <field-type>string</field-type>
            <size>40</size>
            <updateable>true</updateable>
            <required>false</required>
            <code-module></code-module>
            <pattern></pattern>
            <key-type>false</key-type>
        </fields>
        <fields>
            <field-name>MiddleName_Phon</field-name>
            <field-type>string</field-type>
            <size>8</size>
            <updateable>true</updateable>
            <required>false</required>
            <code-module></code-module>
            <pattern></pattern>
            <key-type>false</key-type>
        </fields>
        <fields>
            <field-name>LastName</field-name>
            <field-type>string</field-type>
            <size>40</size>
            <updateable>true</updateable>
            <required>true</required>
            <code-module></code-module>
            <pattern></pattern>
            <key-type>false</key-type>
        </fields>
        <fields>
            <field-name>LastName_Std</field-name>
            <field-type>string</field-type>
            <size>40</size>
            <updateable>true</updateable>
            <required>false</required>
            <code-module></code-module>
            <pattern></pattern>
            <key-type>false</key-type>
        </fields>
        <fields>
            <field-name>LastName_Phon</field-name>
            <field-type>string</field-type>
            <size>8</size>
            <updateable>true</updateable>
            <required>false</required>
            <code-module></code-module>
            <pattern></pattern>
            <key-type>false</key-type>
        </fields>
        <fields>
            <field-name>Suffix</field-name>
            <field-type>string</field-type>
            <size>35</size>
            <updateable>true</updateable>
            <required>false</required>
            <code-module></code-module>
            <pattern></pattern>
            <key-type>false</key-type>
        </fields>
        <fields>
            <field-name>Title</field-name>
            <field-type>string</field-type>
            <size>8</size>
            <updateable>true</updateable>
            <required>false</required>
            <code-module>TITLE</code-module>
            <pattern></pattern>
            <key-type>false</key-type>
        </fields>
        <fields>
            <field-name>MedicareNo</field-name>
            <field-type>string</field-type>
            <size>30</size>
            <updateable>true</updateable>
            <required>true</required>
            <code-module></code-module>
            <pattern></pattern>
            <key-type>false</key-type>
        </fields>
        <fields>
            <field-name>DOB</field-name>
            <field-type>date</field-type>
            <size>12</size>
            <updateable>true</updateable>
            <required>true</required>
            <code-module></code-module>
            <pattern></pattern>
            <key-type>false</key-type>
        </fields>
        <fields>
            <field-name>Death</field-name>
            <field-type>string</field-type>
            <size>1</size>
            <updateable>true</updateable>
            <required>false</required>
            <code-module></code-module>
            <pattern></pattern>
            <key-type>false</key-type>
        </fields>
        <fields>
            <field-name>Gender</field-name>
            <field-type>string</field-type>
            <size>8</size>
            <updateable>true</updateable>
            <required>true</required>
            <code-module>GENDER</code-module>
            <pattern></pattern>
            <key-type>false</key-type>
        </fields>
        <fields>
            <field-name>MStatus</field-name>
            <field-type>string</field-type>
            <size>8</size>
            <updateable>true</updateable>
            <required>false</required>
            <code-module>MSTATUS</code-module>
            <pattern></pattern>
            <key-type>false</key-type>
        </fields>
        <fields>
            <field-name>IndigStatus</field-name>
            <field-type>string</field-type>
            <size>50</size>
            <updateable>true</updateable>
            <required>false</required>
            <code-module>INDIGST</code-module>
            <pattern></pattern>
            <key-type>false</key-type>
        </fields>
        <fields>
            <field-name>Religion</field-name>
            <field-type>string</field-type>
            <size>8</size>
            <updateable>true</updateable>
            <required>false</required>
            <code-module>RELIGION</code-module>
            <pattern></pattern>
            <key-type>false</key-type>
        </fields>
        <fields>
            <field-name>Language</field-name>
            <field-type>string</field-type>
            <size>8</size>
            <updateable>true</updateable>
            <required>false</required>
            <code-module>LANGUAGE</code-module>
            <pattern></pattern>
            <key-type>false</key-type>
        </fields>
        <fields>
            <field-name>Maiden</field-name>
            <field-type>string</field-type>
            <size>40</size>
            <updateable>true</updateable>
            <required>false</required>
            <code-module></code-module>
            <pattern></pattern>
            <key-type>false</key-type>
        </fields>
        <fields>
            <field-name>PobCountry</field-name>
            <field-type>string</field-type>
            <size>20</size>
            <updateable>true</updateable>
            <required>false</required>
            <code-module>COUNTRY</code-module>
            <pattern></pattern>
            <key-type>false</key-type>
        </fields>
        <fields>
            <field-name>DVAColour</field-name>
            <field-type>string</field-type>
            <size>8</size>
            <updateable>true</updateable>
            <required>false</required>
            <code-module>DVACOLOR</code-module>
            <pattern></pattern>
            <key-type>false</key-type>
        </fields>
        <fields>
            <field-name>Status</field-name>
            <field-type>string</field-type>
            <size>8</size>
            <updateable>true</updateable>
            <required>false</required>
            <code-module></code-module>
            <pattern></pattern>
            <key-type>false</key-type>
        </fields>
        <fields>
            <field-name>Dod</field-name>
            <field-type>date</field-type>
            <size>12</size>
            <updateable>true</updateable>
            <required>false</required>
            <code-module></code-module>
            <pattern></pattern>
            <key-type>false</key-type>
        </fields>
        <fields>
            <field-name>DeathCertificate</field-name>
            <field-type>string</field-type>
            <size>10</size>
            <updateable>true</updateable>
            <required>false</required>
            <code-module></code-module>
            <pattern></pattern>
            <key-type>false</key-type>
        </fields>
        <fields>
            <field-name>RepatriationNo</field-name>
            <field-type>string</field-type>
            <size>10</size>
            <updateable>true</updateable>
            <required>false</required>
            <code-module></code-module>
            <pattern></pattern>
            <key-type>false</key-type>
        </fields>
        <fields>
            <field-name>PensionNo</field-name>
            <field-type>string</field-type>
            <size>8</size>
            <updateable>true</updateable>
            <required>false</required>
            <code-module></code-module>
            <pattern></pattern>
            <key-type>false</key-type>
        </fields>
        <fields>
            <field-name>PensionExpDate</field-name>
            <field-type>date</field-type>
            <size>8</size>
            <updateable>true</updateable>
            <required>false</required>
            <code-module></code-module>
            <pattern></pattern>